기업명,제목,작성일,본문,신문사,링크,비고
삼성바이오로직스,삼성바이오·롯데바이오 총출동…‘K-바이오’ 아시아 최대 전시회서 존재감 과시,2025-10-07 13:21:44+09:00,"8~10일 일본 요코하마서 ‘바이오재팬 2025’ 개막 1000여 기업 참가, 신약·재생의료·AI 헬스케어 기술 집결 [헤럴드경제=정주원 기자] 아시아 최대 제약·바이오 전시회인 ‘바이오재팬(BIO JAPAN) 2025’가 8일 일본 요코하마에서 막을 올린다. 추석 연휴에도 국내 주요 제약·바이오 기업들이 대거 참여해 글로벌 무대에서 ‘K-바이오’의 경쟁력을 입증할 예정이다. 7일 업계에 따르면 바이오재팬 조직위원회와 JTB 커뮤니케이션 디자인은 8~10일 요코하마 파시피코 컨벤션센터에서 올해 행사를 개최한다. 1986년 시작된 바이오재팬은 세계에서 가장 오래된 바이오테크 전시회 중 하나로, 바이오의약품·재생의료·디지털 헬스케어·건강기능식품 등 전 분야를 아우르는 아시아 최대 규모의 산업 축제다. 올해는 전 세계 1130여개 기업과 연구기관이 참가하고, 1만8000명 이상의 방문객이 찾을 것으로 예상된다. 주요 주제는 ▷바이오의약품 개발 및 상용화 ▷세포·유전자치료제 상업화 ▷AI 기반 디지털 헬스케어 ▷오픈이노베이션 및 글로벌 협업 등이다. ‘재생의료 재팬(Regenerative Medicine JAPAN)’과 ‘헬스테크 재팬(Health TECH JAPAN)’도 동시에 열려 시너지가 기대된다. 국내에서는 ‘삼성바이오로직스’가 올해 처음으로 단독 부스를 마련해서 참가한다. 2023년부터 3년 연속 참석 중인 삼성바이오는 이번 전시를 통해 글로벌 톱 20 제약사 내 점유율 확대와 신규 고객 확보에 속도를 낸다는 방침이다. 삼성바이오는 ▷항체·약물 접합체(ADC) 생산 역량 ▷세계 최대 규모 생산능력(78.4만ℓ) ▷위탁개발(CDO) 플랫폼 등을 집중적으로 홍보한다. 8일에는 제임스 최 부사장과 케빈 샤프 부사장이 ‘공급망 회복탄력성을 위한 전략적 아웃소싱’을 주제로 발표에 나선다. 롯데바이오로직스는 지난해보다 두 배 확장된 전시 부스를 열고 잠재 고객사와의 파트너링 미팅을 진행한다. 행사 마지막 날인 10일에는 박제임스 대표이사가 직접 연사로 나서 CDMO(위탁개발생산) 전략과 차세대 ADC 시장 경쟁력을 발표할 예정이다. 파로스아이바이오는 미국 컨설팅사 카이로스 바이오컨설팅과 공동 부스를 운영하며 차세대 급성골수성백혈병(AML) 치료제 ‘PHI-101’, 난치성 고형암 치료제 ‘PHI-501’의 기술이전 논의를 심화한다. 이 밖에도 국가신약개발사업단(KDDF), 경보제약, 국민바이오, 연세대학교, 한국과학기술연구원(KIST) 등이 참여해 글로벌 파트너링을 추진한다. 국가독성과학연구소(KIT)는 충북·경북테크노파크와 함께 ‘K-BIO 공동홍보관’을 꾸려 국내 유망 바이오 스타트업의 기술을 소개하는 ‘K-Startup@bio IR DAY’를 개최한다. jookapooka@heraldcorp.com",heraldcorp.com,https://biz.heraldcorp.com/article/10589989?ref=naver,정상 (1차)
삼성바이오로직스,삼성·롯데 'K-바이오' 앞세운다... 바이오재팬 8일 개막,2025-10-07 12:36:03+09:00,"[파이낸셜뉴스] 아시아 최대 제약·바이오 전시회 '바이오재팬'(BIO JAPAN)이 8일 일본 요코하마에서 개막해 사흘간의 일정에 들어간다.7일 제약바이오업계에 따르면 바이오재팬 조직위원회와 JTB 커뮤니케이션 디자인은 8~10일 일본 요코하마 파시피코 컨벤션센터에서 '바이오재팬 2025'를 진행한다. 지난 1986년 시작된 바이오재팬은 가장 오래된 바이오테크 전시회 중 하나로, 최신 바이오 의약품과 재생의료, 디지털 헬스케어, 건강기능식품 등 다양한 바이오 관련 제품이 전시되는 아시아 최대 행사이다. 올해는 전 세계 1130여개 기업과 연구기관이 참가하고 1만8000명 이상 방문객이 다녀갈 것으로 예상된다. 주요 주제는 바이오 의약품 개발 및 상용화, 재생의료 및 세포치료제 상업화 방안, 디지털 헬스케어의 인공지능(AI) 및 데이터 기반 솔루션과 오픈 이노베이션 및 글로벌 협업 강화 등이다. 국내에서는 최대 제약바이오 기업인 삼성바이오로직스가 단독 부스를 마련해 참가하고, 송도 바이오 캠퍼스를 조성 중인 롯데바이오로직스도 부스를 설치한다. 2023년부터 3년 연속 참가하는 삼성바이오로직스는 올해 최초로 단독 부스를 마련해 글로벌 톱 20 제약사 내 점유율 확대와 톱 40위권 제약사 대상 신규 고객 확보에 박차를 가할 계획이다. 삼성바이오로직스는 부스에서 △항체·약물 접합체(ADC) 생산 역량 △5공장(18만ℓ) 등 세계 최대 생산능력(78.4만ℓ) △위탁개발(CDO) 플랫폼 등 차별화된 서비스를 집중 소개한다. 빠르게 성장하는 아시아 시장을 고려해 지난 3월 가동을 시작한 ADC 전용 생산시설 등 첨단 설비 기반의 원스톱 위탁개발생산(CDMO) 역량을 강조할 구상이다. 롯데바이오로직스는 지난해 대비 2배 이상 커진 단독 전시 부스에서 자사 소개와 잠재 고객사와의 파트너링 미팅을 진행할 예정이다. 행사 3일차인 10일 오후 세미나에서는 박제임스 대표이사가 연사로 나서 CDMO 전략과 성장하는 차세대 ADC(항체·약물접합체) 시장을 주제로 발표를 통해 시장 경쟁력을 강조할 예정이다. 인공지능(AI) 기반 혁신신약 개발 전문기업 파로스아이바이오는 전략적 파트너사인 미국 컨설팅 기업 카이로스 바이오컨설팅(Kairos Bioconsulting)과 공동 참여한다. 주요 파이프라인인 차세대 급성 골수성 백혈병(AML) 치료제 'PHI-101', 난치성 고형암 치료제 'PHI-501'의 기술 이전 논의를 심화하고, 양사의 네트워크를 바탕으로 다양한 사업 기회를 발굴할 예정이다. 국가신약개발사업단(KDDF)과 경보제약, 국민바이오, 연세대 등도 부스를 마련해 파트너링에 나선다. hippo@fnnews.com 김찬미 기자 ※ 저작권자 ⓒ 파이낸셜뉴스, 무단전재-재배포 금지",fnnews.com,http://www.fnnews.com/news/202510071232001466,정상 (1차)
삼성바이오로직스,"국내 제약·바이오, 미국 관세 리스크·신약 개발·바이오시밀러 경쟁 ‘3중 과제’",2025-10-07 11:22:06+09:00,"미국 생산 거점 없는 기업 비상…신약 성과·바이오시밀러 경쟁 변수 트럼프 100% 관세·글로벌 신약 격차·퍼스트 무버 확보, 긴장 지속 [헤럴드경제=정주원 기자] 추석 연휴 이후 국내 제약·바이오 업계는 올 한 해 유종의 미를 거두기 위해 풀어야 할 과제들을 안고 있다. 가장 시급한 문제로는 미국발 의약품 관세 리스크가 꼽힌다. 지난달 도널드 트럼프 미국 대통령이 미국 내 생산 공장이 없는 기업의 의약품에 대해 100% 관세를 부과하겠다고 밝히면서 국내 기업들은 대응책 마련에 분주하다. 셀트리온·롯데바이오로직스·SK바이오팜 등은 미국 생산 거점 확보로 리스크를 일정 부분 해소했지만, 삼성바이오로직스 등은 관세 부과 여부와 구체적 시행 방안을 주시하며 긴장하고 있다. 신약 개발 역시 연말까지 주요 과제로 남아 있다. 올해 1~9월 허가된 국산 신약으로는 메디톡스의 지방분해주사제 ‘뉴비쥬주’와 GC녹십자의 탄저백신 ‘배리트락스주’ 등이 있지만, 글로벌 빅파마와 비교하면 성과는 미흡한 수준이다. LG화학은 통풍 치료제 임상 3상을 자진 중단했고, 국내 기업들은 한정된 자원과 개발 속도를 고려해 전략적 선택이 요구되는 상황이다. 한국제약바이오협회는 범국가적 신약 개발 지원과 전문 인력 육성 필요성을 강조했다. 바이오시밀러 경쟁력 확보도 남은 과제 중 하나다. 지난달 국내 기업 최소 6곳의 바이오시밀러가 허가를 받으면서 글로벌 시장 경쟁이 심화하고 있다. 주요 오리지널 의약품 특허 만료와 미국 약값 인하 정책으로 시장 선점 경쟁이 치열해질 전망이다. 기업들은 퍼스트 무버 지위를 확보하고 가격과 판매망을 기반으로 차별화 전략을 세워야 하며, 오리지널 의약품 개발사의 특허 방어 전략도 돌파해야 한다. 업계는 머크가 키트루다 SC 제형을 통해 바이오시밀러 추격을 견제할 것으로 보고 있다. 연말까지 미국 관세, 신약 개발, 바이오시밀러 경쟁이라는 3중 과제가 국내 제약·바이오 업계를 압박할 것으로 전망된다. 업계 관계자는 “글로벌 경쟁 속에서 전략적 선택과 시장 대응 능력이 기업 성패를 가를 것”이라고 말했다. jookapooka@heraldcorp.com",heraldcorp.com,https://biz.heraldcorp.com/article/10589967?ref=naver,정상 (1차)
삼성바이오로직스,"""5년간 상장 안해"" 정관명시...삼성바이오 분할 임박",2025-10-07 08:30:00+09:00,"삼성바이오, 17일 인적분할 임시주총 정관에 '5년간 상장 않겠다' 명시 이해상충 등 불확실성 해소 정관에 '5년간 상장 않겠다' 명시 이해상충 등 불확실성 해소 [파이낸셜뉴스] 삼성바이오로직스가 다음달 인적분할을 앞두고 사실상의 마지막 관문인 주주총회를 개최한다. 삼성바이오로직스는 정관에 향후 5년간 분할회사를 상장하지 않겠다는 내용을 명시하는 등 인적분할의 당위성을 확보하고 성장동력 확대에 주력할 방침이다. 7일 업계에 따르면 삼성바이오로직스는 오는 17일 임시주총을 열고 인적분할 안건을 의결한다. 인적분할을 통해 삼성에피스홀딩스(가칭)를 설립하고 바이오의약품 위탁개발생산(CDMO) 사업과 바이오시밀러 사업을 분리하기 위한 내용이다. 기존 삼성바이오로직스는 CDMO 사업에 집중하고, 자회사인 삼성바이오에피스는 별도의 지주회사인 '삼성에피스홀딩스'로 분리된다. 제약바이오업계는 이번 분할이 삼성바이오로직스가 갖고 있던 이해상충 등 리스크를 다소 해소할 수 있는 계기가 될 것으로 보고 있다. 삼성바이오로직스는 CDO 사업 역량 강화를 위해 바이오의약품 개발 및 상업화 사업을 하는 삼성바이오에피스를 2022년 100% 자회사화했다. 하지만 삼성바이오에피스의 바이오의약품 개발 및 상업화 사업이 성장하면서 CDMO 사업을 하는 삼성바이오로직스 고객들인 글로벌 신약 개발사들이 삼성바이오로직스와 삼성바이오에피스 간 엄격한 '파이어월' 구축에도 불구 이해상충 우려를 제기했다는 설명이다. 실제로 지난 2023년 삼성바이오로직스와 미국 글로벌 A사 간 블록버스터급 신약 약물 B계약에 경쟁조항이 삽입됐다. 이후 2024년 삼성바이오로직스와 삼성바이오에피스 사이에 삼성바이오에피스가 개발한 약물B 시밀러 수주 계약 과정에서 이해상충 문제가 제기되기도 했다. 이에 따라 기존 A사의 약물B 생산 및 품질검사 공간을 삼성바이오에피스의 약물B 시밀러 제품과 공유할 수 없었다는 것이다. 결국 협의에 따라 삼성바이오에피스의 약물B 시밀러 제품은 기존 생산시설인 바이오1 캠퍼스가 아닌 곳에서 생산하고 외주 시험업체를 통해 품질검사를 수행하게 됐다. 이로 인해 운영 복잡성 및 추가비용이 발생하게 됐다. 여기에 2024년에는 삼성바이오로직스와 미국 글로벌 제약사 C사간 수주 계약 과정에서 C사의 약물 D, E에 대해 삼성바이오에피스에서 시밀러 개발 및 보유를 하고 있어 수주계약 체결이 지연됐던 사례도 있었다. 글로벌 제약사 F사의 경우에는 삼성바이오로직스와 삼성바이오에피스를 동일한 실체로 인식해 수주계약 논의 자체가 불가능한 것으로 전해졌다. 투자자 측면에서도 CDMO 사업과 개발 사업이 혼재되면서 기업가치를 평가하는데 어려움이 있었다는 설명이다. 삼성바이오로직스는 인적분할을 통해 CDMO 사업과 바이오시밀러 개발 및 상업화 사업을 분리해 이해상충 우려를 해소하고 명확한 사업영역을 설정해 적절한 기업가치를 평가받을 수 있게 될 것으로 기대하고 있다. 삼성바이오로직스는 특히 이번 분할 과정에서 투자자들의 우려를 감안해 향후 5년간 삼성바이오에피스 상장을 추진하지 않겠다는 내용을 정관에 명시하기로 했다. 업계 관계자는 ""삼성바이오로직스의 실적개선이 지속되는 상황에서 인적분할은 이해상충 등 불확실성 해소 차원에서 긍정적""이라면서 ""기업가치 평가 측면에서도 순수 CDMO 기업으로서의 가치를 제대로 인정받을 수 있을 전망""이라고 설명했다. kim091@fnnews.com 김영권 기자 ※ 저작권자 ⓒ 파이낸셜뉴스, 무단전재-재배포 금지",fnnews.com,http://www.fnnews.com/news/202510041030374353,정상 (1차)
삼성바이오로직스,"K-바이오, 8일 '바이오재팬' 출격…""CDMO·신약개발 협력 확대""[바이오재팬]",2025-10-07 08:10:00+09:00,"이엔셀 관계자가 세포유전자 치료제를 연구하고 있다.(이엔셀 제공)/뉴스1국가신약개발사업단(KDDF)이 바이오 재팬 2025에서 국내 기업들의 해외 진출을 위한 지원에 나선다./뉴스1 황진중 기자관련 키워드바이오재팬삼성바이오로직스롯데바이오로직스이엔셀파로스아이바이오위탁개발생산CDMO경보제약황진중 기자 존 림 ""세계 3위 日 바이오시장 공략…추가 계약 막바지""[바이오재팬]K-바이오, 2만명 집결 아시아 CDMO 행사서 수주 총력전[바이오재팬]관련 기사K-바이오, 2만명 집결 아시아 CDMO 행사서 수주 총력전[바이오재팬]삼성바이오·KDDF, '바이오재팬' 참가…""아시아 진출 가속""[바이오재팬]",news1.kr,https://www.news1.kr/bio/pharmaceutical-bio/5935424,정상 (1차)
현대차,"""차 막혀도 괜찮아""…OTT·게임 다 되는 '바퀴 달린 스마트폰'",2025-10-09 21:51:59+09:00,"""차 막혀도 괜찮아""…OTT·게임 다 되는 '바퀴 달린 스마트폰' - 기사 스크랩 - 공유 - 댓글 - 클린뷰 - 프린트 고객 경험 강화 위해 차량용 인포테인먼트 분야 ‘집중’ 추석 연휴와 같이 차량 이동이 많은 기간에는 정체로 인해 차 안에서 보내는 시간이 평소보다 더 길어진다. 차량이 단순 이동수단을 넘어 ’바퀴 달린 스마트폰‘으로 진화하면서 자동차의 변신에 속도가 붙고 있다. 9일 관련 업계에 따르면 완성차 업체들은 고객 경험 강화를 위해 차량용 인포테인먼트 분야에 집중하고 있다. 인포테인먼트는 운전자와 승객에게 정보와 오락을 제공하기 위해 차량에 장착된 하드웨어.소프트웨어 시스템으로 초기에는 내비게이션 정도였으나 이제는 그 분야도 다양해지는 추세다. 르노코리아는 최근 2026년형 그랑 콜레오스를 선보이면서 인포테인먼트 기능을 강화했다. 동승석까지 이어지는 오픈알(openR) 파노라마 스크린을 통해 R:아케이드 게임, R-비트(beat) 노래방 서비스를 제공한다. R:아케이드 게임은 대중적 인기를 얻은 20가지 캐주얼 게임들을 차량에 최적화된 환경에서 제공하는 서비스다. 게임 종류에 따라 스마트폰을 게임패드로 활용할 수도 있다. 게임 서비스는 1년 무상 이용 후 유료 전환을 선택할 수 있다. 현대차는 올 초 출시한 프리미엄 플래그십 대형 스포츠유틸리티차(SUV) ‘디 올 뉴 팰리세이드’에 원하는 디지털 사양을 언제든지 추가 구매할 수 있는 ‘블루링크 스토어’를 선보였다. 신형 팰리세이드 고객이 블루링크 스토어를 통해 구매 가능한 디지털 사양은 △고음질 음악 스트리밍(멜론, 지니 뮤직, 네이버 바이브)과 비디오 스트리밍(유튜브, 왓차, 웨이브, LG U+ 모바일 TV)을 지원하는 ‘스트리밍 플러스’ △차량용 webOS 콘텐츠 플랫폼 (넷플릭스, 디즈니 플러스, 티빙, TJ노래방, 아기상어, 게임, 헤이스택 뉴스 등)이 추가된 ‘스트리밍 프리미엄’ 등이 있으며 앞으로도 선택 가능한 사양들을 늘려나갈 계획이다. 기아는 전동화 세단 ‘EV4’에 기아 AI 어시스턴트를 탑재하고 혁신적인 커넥티비티 사양을 적용해 고객에게 의미 있고 편리한 차량 경험을 선사한다. 고객이 기아 커넥트 스토어에서 ‘스트리밍 프리미엄’ 서비스 가입 시 차량 안에서 넷플릭스, 디즈니 플러스, 스포티비 나우 등 OTT 서비스 및 유튜브를 시청하고 게임, 노래방 등 다양한 콘텐츠를 즐길 수 있다. BMW코리아의 경우 ‘BMW 오퍼레이팅 시스템 8.5’ 이상이 탑재된 모델에서 모두 스마트폰과 연동한 에어콘솔 게이밍 기능을 제공하고 있다. 게임 외에도 영상, 음악 스트리밍 등 써드파티 앱 사용이 가능하다. 비야디(BYD)코리아는 현재 국내 판매 중인 아토 3, 씰, 씨라리언 7 등 전 차종에 스팅레이(Sting Ray) 가라오케 앱을 기본 탑재, 차량 내 노래방 기능을 제공하고 있다. BYD코리아는 앞으로도 고객들이 가족이나 친구와 함께 드라이브 중에도 특별한 순간을 즐길 수 있도록 인포테인먼트 경험을 지속적으로 강화해 나갈 예정이다. 이처럼 자동차 업계가 엔터테인먼트를 위한 콘텐츠 확보에 적극적으로 나서는 이유는 자율주행 기술이 발전하고 있기 때문이다. 향후 전방을 주시하지 않아도 되는 아이 오프(eye off) 단계를 넘어 운전에 아예 신경을 쓰지 않아도 되는 자율 주행 레벨 4단계까지 바라보고 있다. 업계 한 관계자는 “과거에는 운송수단으로서의 자동차가 중요했다면 이제는 목적지까지 무엇을 하면서 어떻게 이동하느냐가 중요해졌다”며 “자동차 자체가 전자 기기로 작동하는 시대”라고 말했다. 차은지 한경닷컴 기자 chachacha@hankyung.com 9일 관련 업계에 따르면 완성차 업체들은 고객 경험 강화를 위해 차량용 인포테인먼트 분야에 집중하고 있다. 인포테인먼트는 운전자와 승객에게 정보와 오락을 제공하기 위해 차량에 장착된 하드웨어.소프트웨어 시스템으로 초기에는 내비게이션 정도였으나 이제는 그 분야도 다양해지는 추세다. 르노코리아는 최근 2026년형 그랑 콜레오스를 선보이면서 인포테인먼트 기능을 강화했다. 동승석까지 이어지는 오픈알(openR) 파노라마 스크린을 통해 R:아케이드 게임, R-비트(beat) 노래방 서비스를 제공한다. R:아케이드 게임은 대중적 인기를 얻은 20가지 캐주얼 게임들을 차량에 최적화된 환경에서 제공하는 서비스다. 게임 종류에 따라 스마트폰을 게임패드로 활용할 수도 있다. 게임 서비스는 1년 무상 이용 후 유료 전환을 선택할 수 있다. 현대차는 올 초 출시한 프리미엄 플래그십 대형 스포츠유틸리티차(SUV) ‘디 올 뉴 팰리세이드’에 원하는 디지털 사양을 언제든지 추가 구매할 수 있는 ‘블루링크 스토어’를 선보였다. 신형 팰리세이드 고객이 블루링크 스토어를 통해 구매 가능한 디지털 사양은 △고음질 음악 스트리밍(멜론, 지니 뮤직, 네이버 바이브)과 비디오 스트리밍(유튜브, 왓차, 웨이브, LG U+ 모바일 TV)을 지원하는 ‘스트리밍 플러스’ △차량용 webOS 콘텐츠 플랫폼 (넷플릭스, 디즈니 플러스, 티빙, TJ노래방, 아기상어, 게임, 헤이스택 뉴스 등)이 추가된 ‘스트리밍 프리미엄’ 등이 있으며 앞으로도 선택 가능한 사양들을 늘려나갈 계획이다. 기아는 전동화 세단 ‘EV4’에 기아 AI 어시스턴트를 탑재하고 혁신적인 커넥티비티 사양을 적용해 고객에게 의미 있고 편리한 차량 경험을 선사한다. 고객이 기아 커넥트 스토어에서 ‘스트리밍 프리미엄’ 서비스 가입 시 차량 안에서 넷플릭스, 디즈니 플러스, 스포티비 나우 등 OTT 서비스 및 유튜브를 시청하고 게임, 노래방 등 다양한 콘텐츠를 즐길 수 있다. BMW코리아의 경우 ‘BMW 오퍼레이팅 시스템 8.5’ 이상이 탑재된 모델에서 모두 스마트폰과 연동한 에어콘솔 게이밍 기능을 제공하고 있다. 게임 외에도 영상, 음악 스트리밍 등 써드파티 앱 사용이 가능하다. 비야디(BYD)코리아는 현재 국내 판매 중인 아토 3, 씰, 씨라리언 7 등 전 차종에 스팅레이(Sting Ray) 가라오케 앱을 기본 탑재, 차량 내 노래방 기능을 제공하고 있다. BYD코리아는 앞으로도 고객들이 가족이나 친구와 함께 드라이브 중에도 특별한 순간을 즐길 수 있도록 인포테인먼트 경험을 지속적으로 강화해 나갈 예정이다. 이처럼 자동차 업계가 엔터테인먼트를 위한 콘텐츠 확보에 적극적으로 나서는 이유는 자율주행 기술이 발전하고 있기 때문이다. 향후 전방을 주시하지 않아도 되는 아이 오프(eye off) 단계를 넘어 운전에 아예 신경을 쓰지 않아도 되는 자율 주행 레벨 4단계까지 바라보고 있다. 업계 한 관계자는 “과거에는 운송수단으로서의 자동차가 중요했다면 이제는 목적지까지 무엇을 하면서 어떻게 이동하느냐가 중요해졌다”며 “자동차 자체가 전자 기기로 작동하는 시대”라고 말했다. 차은지 한경닷컴 기자 chachacha@hankyung.com ADVERTISEMENT ADVERTISEMENT",hankyung.com,https://www.hankyung.com/article/202510022789g,정상 (1차)
