기업명,제목,작성일,본문,신문사,링크,비고
삼성전자,"퀄컴, 아두이노 인수.. 풀스택 엣지 생태계 확장",2025-10-09 23:09:58+09:00,"퀄컴은 이탈리아 오픈 소스 하드웨어 및 소프트웨어 기업 아두이노를 인수한다고 9일 밝혔다. 아두이노는 하드웨어 스타트업과 로보틱스 연구실에서 시제품 제작용으로 널리 사용되는 저렴한 회로 기판 및 컴퓨터 관련 업체다. 퀄컴은 인수 가격 등 구체적인 거래 내용은 공개하지 않고, 아두이노가 독립 자회사로 운영될 것이라고 전했다. 퀄컴의 이번 인수는 로보틱스 사업을 강화하기 위한 포석으로 풀이된다. 퀄컴은 삼성전자 갤럭시 등 휴대전화에 들어가는 핵심 칩 주요 공급업체이지만, 그동안 커넥티드 차량과 무선 이어폰, 노트북 컴퓨터 및 산업용 기계와 같은 다른 분야로 사업을 확장해 왔다. 아두이노는 저렴하고 사용하기 쉬운 오픈소스 하드웨어(회로 기판)와 소프트웨어를 제공해 전 세계 학생과 취미 활동가, 스타트업, 전문 엔지니어들이 로봇이나 전자기기의 시제품(프로토타입)을 만들 때 가장 먼저 찾는 플랫폼이다. 로봇 공학자를 꿈꾸는 학생들이나 이제 막 사업을 시작하는 스타트업이 아두이노를 통해 아이디어를 구현하는데, 퀄컴은 이들이 학생 시절부터 자사 기술에 익숙해지게 함으로써 나중에 상용 제품을 개발할 때 자연스럽게 자사의 고성능 칩을 선택하도록 유도할 수 있다. 아두이노는 퀄컴 계열사로 편입되지만 독립적인 브랜드, 툴 및 사명을 유지하며 기존대로 다양한 반도체 공급 업체가 제공하는 광범위한 마이크로컨트롤러 및 마이크로프로세서를 지원한다. 이번 인수를 통해 3300만명 이상의 아두이노 커뮤니티 사용자들은 퀄컴의 기술 스택과 글로벌 영향력을 활용할 수 있다. 기업가, 사업체, 기술 전문가, 학생, 교육자 및 일반 사용자들은 퀄컴의 첨단 기술과 광범위한 파트너 생태계를 통해 새로운 솔루션의 프로토타입을 신속하게 제작하고 테스트할 수 있으며 상용화까지 지원받을 수 있다. 아두이노는 처음으로 퀄컴 칩을 탑재한 회로 기판을 출시할 예정이라고 전했다. 이 기판은 '드래곤윙 QRB2210'이라는 퀄컴 프로세서가 장착된다. 나쿨 두갈 퀄컴 오토모티브, 산업 및 임베디드 IoT 부문 본부장은 “파운드리아이오, 엣지 임펄스에 이어 아두이노를 인수함으로써 글로벌 개발자 커뮤니티를 위한 첨단 AI 및 컴퓨팅 제품 접근성을 높이겠다는 퀄컴의 비전을 가속화하고 있다”며 ""아두이노는 역동적인 글로벌 개발자 및 크리에이터 커뮤니티를 구축했다. 퀄컴은 아두이노의 오픈소스 정신과 퀄컴의 선도적인 제품 및 기술 포트폴리오를 결합해 수백만명의 개발자들이 지능형 솔루션을 더 빠르고 효율적으로 만들도록 지원하는 동시에 퀄컴 생태계의 규모를 활용해 글로벌 상용화의 길까지 열어주고 있다""고 말했다. solidkjy@fnnews.com 구자윤 기자 ※ 저작권자 ⓒ 파이낸셜뉴스, 무단전재-재배포 금지",fnnews.com,http://www.fnnews.com/news/202510092303271936,정상 (1차)
삼성전자,한글날 맞아… 美서 한글트럭 ‘씽씽’,2025-10-09 21:40:00+09:00,"프린스턴 등 6개 대학 순회 전시 삼성전자가 한글날을 맞아 미국 주요 대학교에서 뉴욕한국문화원, 세계적인 설치미술가 강익중 작가와 함께 한글의 아름다움과 가치를 알리는 ‘한글트럭’ 프로젝트를 진행했다고 9일 밝혔다. 한글트럭은 강 작가가 글자 하나하나로 만든 ‘한글 큐브’를 활용해 트럭 전면을 대형 예술작품으로 만든 프로젝트다. 강 작가는 뉴욕을 기반으로 활동하는 세계적인 설치미술작가로 1997년 베니스 비엔날레 특별공로상, 2012년 한국 문화대상(대통령상), 2021년 세종문화상 등을 수상했다. 삼성전자는 지난달 26일(현지시간)부터 미국 예일, 코넬, 프린스턴 등 6개 대학을 순회하며 한글트럭을 전시했다. 삼성전자는 갤럭시 Z 폴드7의 통역기능을 활용해 관람객들이 ‘미래의 나에게 보내는 메시지’를 영어로 입력하면 한글트럭의 대화면에 한국어 번역본을 띄우는 이벤트도 진행했다. 최승은 삼성전자 MX사업부 모바일마케팅센터 부사장은 이번 한글트럭 전시에 대해 “쉽게 조합하고 확장할 수 있는 열린 언어 ‘한글’과 세상을 연결하는 열린 기술인 ‘갤럭시’가 만나 한글의 고유한 아름다움과 가치를 보여주는 프로젝트”라고 말했다. 강 작가는 “과거 세종대왕이 백성을 위해 창제한 한글이 오늘날 젊은 세대들이 자신에게 보내는 꿈의 메시지와 만나 함께 숨쉬는 특별한 무대”라고 했다. Copyright ⓒ 세계일보. 무단 전재 및 재배포 금지",segye.com,https://www.segye.com/newsView/20251009508897?OutUrl=naver,정상 (1차)
삼성전자,“접는폰 사면 50만원 신형 워치 준다” 갑자기 무슨 일이…1위 뺏긴 삼성 ‘초강수’,2025-10-09 21:40:00+09:00,"[헤럴드경제=박영훈 기자] 폴더블폰 시장 세계 1위 자리를 중국에 빼앗긴 삼성전자가 파격 혜택으로 점유율 확대에 나선다. 9일 샘모바일 등 외신에 따르면 삼성전자는 최신 폴더블폰 ‘갤럭시Z플립 7’을 사는 영국내 모든 고객에게 ‘갤럭시워치8’를 무료로 준다. 삼성전자는 향후 영국 뿐아니라 전 세계 시장에서 파격적인 혜택으로 폴더블폰 점유율을 확대할 것으로 보인다. ‘갤럭시워치8’는 삼성전자가 최근 출시한 스마트워치로 가격이 50여만원에 달한다. 갤럭시워치 중 가장 슬림한 디자인을 적용해 뛰어난 착용감을 제공한다. 전작 대비 두께가 11% 얇아졌으며, 생성형 AI 기능을 기반으로 한층 강화된 헬스케어 기능을 제공한다. 삼성이 파격 사은품 공세에 나선 것은 화웨이, 모토로라 등 중국업체들이 가격을 무기로 폴더블폰 시장에서 삼성의 점유율을 잠식하고 있기 때문으로 보인다. 중국 화웨이, 모토로라가 가격을 무기로 삼성전자를 제치고 올해 2분기 전 세계 폴더블폰 시장에서 1,2위를 차지했다. 폴더블폰 절대강자였던 삼성으로서는 뼈아프다. 삼성 제품을 베끼던 중국업체들이 삼성을 추월했다. 시장조사업체 카운터포인트리서치에 따르면 모토로라는 올 2분기 점유율 28%를 기록하며, 9%에 그친 삼성전자를 제쳤다. 1위는 45%를 기록한 화웨이가 차지했다. 모토로라가 삼성전자에 비해 저렴한 가격으로 시장에서 경쟁력을 얻었다는 분석이다. 모토로라의 폴더블폰은 150만원대 달하는 삼성 ‘갤럭시Z플립7’보다도 70만원이나 싸다. 업계 관계자는 “모토로라의 제품은 현재 가장 저렴한 폴더블폰으로, 아직 이 가격에 근접한 경쟁 재품은 없다”고 전했다. 한편 중국업체들은 스마트워치 시장에서도 가격 공세로 애플, 삼성을 제치고 1,2위를 차지했다. 글로벌 시장조사기관 IDC에 따르면 올해 2분기 웨어러블 시장(스마트워치)에서 화웨이 점유율 20%, 샤오미 19.3%, 애플 15%, 삼성전자는 6.5%로 4위 자리로 밀려났다. 삼성의 추락은 중국업체들의 가격 공세 때문이다. park@heraldcorp.com",heraldcorp.com,https://biz.heraldcorp.com/article/10590552?ref=naver,정상 (1차)
삼성전자,증시 10월 ‘불장’ 이어가나… 고환율·美관세 변수,2025-10-09 19:38:52+09:00,"반도체·IT종목 동반상승 랠리 주도 수출 지표 호조에 경기 회복 기대감 10월 주요 업종 숨고르기 가능성도 원화 약세 계속 땐 외국인 수급 부담 의약품·車부품 등 관세 직격탄 우려 배당소득 분리과세 등 정책도 영향 2025년 코스피 ETF 수익률 예금의 30배 연휴 직전 3500 고지에 올라선 코스피가 10월에도 상승세를 이어갈지 시장의 관심이 쏠리고 있다. 반도체 주도 랠리와 경기 회복 기대감이 이어지고 있지만, 환율과 미국 경제지표 등이 단기 변동성을 키울 가능성이 있다. 9일 한국거래소에 따르면 KRX 반도체지수는 9월1일부터 30일까지 26.8% 상승해 같은 기간 코스피 상승률(9.0%)을 크게 웃돌았다. 특히 삼성전자 주가는 6만7600원에서 8만3900원으로 24.1%, SK하이닉스는 25만6000원에서 34만7500원으로 35.7% 뛰었다. LG디스플레이(23.6%)와 삼성전기(19.3%) 등 주요 정보기술(IT) 종목도 동반 상승하며 시장을 견인했다. 분기별 국내 주식시장 전체 시가총액도 삼성전자와 SK하이닉스 등 대장주의 상승에 힘입어 331조원이 늘었다. 기업분석전문 한국CXO연구소가 코스피·코스닥·코넥스 종목을 분석한 결과를 보면 삼성전자 시총이 353조9943억원에서 496조6576억원으로 142조6632억원 늘었고, SK하이닉스는 40조441억원 증가했다. 수출 지표와 경기 회복세는 여전히 긍정적이다. 한국무역협회에 따르면 4분기 수출산업경기전망지수는 101.4로 2년 만에 다시 기준선(100)을 웃돌았다. 반도체 업종 지수가 145.8로 가장 높았고, 무선통신기기·가전 등 IT 품목도 개선세를 보였다. 경기선행지수 역시 3개월 연속 상승하며 반등 흐름을 나타냈다. 이런 상황에서 코스피는 명절 직전인 2일 사상 처음으로 3500선을 뚫고 3549.21에 마감했다. 9월 랠리를 이끌었던 반도체 업종이 10월 들어선 숨고르기에 들어갈 거란 예측도 나온다. 지난달까지 이어진 미국발 기술주 훈풍과 반도체 실적 개선 기대감이 이미 주가에 상당 부분 반영됐다는 이유에서다. IT 기기 신제품 출시가 줄어드는 시기라는 점도 영향을 미칠 전망이다. 환율과 관세, 미국 지표 등 외부 변수에 따라 단기 조정과 반등이 교차할 가능성도 있다. 최근 달러 지수 하락 폭보다 원화 약세가 두드러지면서 외국인 수급에 부담이 될 수 있다. 9월 한 달간 달러 지수가 0.4% 움직이는 동안 원·달러 환율은 1.4% 상승했다. 도널드 트럼프 미 행정부의 신규 관세 부과는 수출 기업에 부담으로 작용할 전망이다. 미국에 공장이 없는 한국산 의약품에는 100% 관세가, 가구류와 차량 부품에는 25∼50% 관세가 적용된다. 미국 제조업 경기는 다소 개선됐으나 여전히 위축 국면에 머물고 있다. 미국 공급자관리협회(ISM)가 3일 발표한 9월 제조업 구매관리자지수(PMI)는 49.1로 전월(48.7)보다 0.4포인트 상승했지만 7개월 연속 기준선(50)을 밑돌았다. 신규수주 지수는 48.9로 전월(51.4) 대비 하락해 경기 둔화 우려를 키웠다. 국내 정책 요인도 변수로 남았다. 정부와 국회에서는 최근 투자자의 배당소득에 대한 세율을 인하하는 법안을 발의했다. 정부와 여당안은 고배당 기업에 투자해 번 현금 배당액을 금융소득 종합과세 대상에서 제외해 분리과세하도록 하는 내용을 골자로 한다. 야권은 모든 주식 배당소득에 대해 전면 분리과세를 하는 법안을 추진 중이다. 기업의 배당 확대를 유도하고 이를 통해 주식시장에 활력을 불어넣겠단 취지다. 올해 들어 코스피를 추종하는 상장지수펀드(ETF) 수익률이 정기예금의 30배에 달한다는 분석도 나왔다. 대신증권에 따르면 올해 1월2일부터 이달 1일까지 국내 대형주 200개 종목의 주가 흐름을 반영하는 ‘KODEX 200’은 3만1305원에서 4만8135원으로 53.76% 상승했다. 같은 기간 5대(KB국민·신한·우리·하나·NH농협) 시중은행의 1년 정기예금 금리(평균 1.61%)를 33배 이상 웃도는 수치다. Copyright ⓒ 세계일보. 무단 전재 및 재배포 금지",segye.com,https://www.segye.com/newsView/20251009508846?OutUrl=naver,정상 (1차)
삼성전자,"중국의 추격, 관세폭탄…험난한 글로벌 환경…'기업가 정신' 재무장으로 미래시장 개척하라",2025-10-09 18:55:11+09:00,"중국의 추격, 관세폭탄…험난한 글로벌 환경…'기업가 정신' 재무장으로 미래시장 개척하라 - 기사 스크랩 - 공유 - 댓글 - 클린뷰 - 프린트 신기술로 미래준비 힘쓰는 기업들 삼성·SK하이닉스, 오픈AI와 협력 AI데이터센터 구축에 HBM 등 공급 현대차, 전기차·하이브리드 신차 출격 LG, 'ABC' 성장 산업에 50조원 투자 한화·HD현대, '마스가'로 새 시장 개척 ""각종 규제 등 미래준비 걸림돌 제거 기업들에게 '혁신의 장' 깔아줘야"" 삼성·SK하이닉스, 오픈AI와 협력 AI데이터센터 구축에 HBM 등 공급 현대차, 전기차·하이브리드 신차 출격 LG, 'ABC' 성장 산업에 50조원 투자 한화·HD현대, '마스가'로 새 시장 개척 ""각종 규제 등 미래준비 걸림돌 제거 기업들에게 '혁신의 장' 깔아줘야"" 한국경제신문이 창간된 1964년 한국의 1인당 국민소득(GDP·국내총생산)은 103달러였다. 올해 1인당 국민소득은 약 3만6000달러로 예상된다. 61년 사이 한국 국민의 소득은 350배 늘었고, 선진국에 들어섰다. 2차 세계대전 이후 한국을 유일하게 선진국으로 올려 세운 동력은 기업이란 사실을 부정하는 사람은 없다. 반도체, 자동차, 가전, 조선, 석유화학, 철강, 식품, 화장품, 바이오 등 한국을 대표하는 기업이 잇따라 탄생했고, 그들이 구축한 생태계에서 일자리와 세금으로 이룬 결과다. 앞으로는 밝지 않다. 올 들어 한국을 둘러싼 글로벌 기업 환경이 수많은 변수와 도전에 직면해 있어서다. 도널드 트럼프 미국 대통령 취임 이후 미국의 관세 폭탄으로 시작된 글로벌 무역 퇴조와 주력 산업에서 중국 기업들의 추격 혹은 역전이 가시화하고 있다. 저출생으로 인구는 감소하는 와중에 미래 산업인 인공지능(AI), 로봇, 우주, 양자 등에서 미국, 중국 기업들은 한국 기업들을 따돌리고 저 멀리 뛰쳐나가고 있다. 한국 기업들은 뒤처지지 않기 위해 미래 준비에 전력을 다하고 있다. 그 선두에 AI를 앞세운 삼성과 SK가 있다. 지난 1일 방한한 샘 올트먼 오픈AI 최고경영자(CEO)는 이재용 삼성전자 회장, 최태원 SK그룹 회장에게 최대 100조원 규모의 고대역폭메모리(HBM) 수주를 약속했다. 오픈AI가 추진 중인 700조원 규모로 지어지는 AI데이터센터인 스타게이트 프로젝트에 두 회사의 HBM이 들어간다는 얘기다. HBM 외에도 삼성은 가전, TV, 반도체, 스마트폰 등 모든 제품에 AI를 접목하고 있다. 글로벌 시장을 장악한 제품에 AI를 더하겠다는 전략이다. 이와 함께 헬스케어와 로봇 냉난방공조(HVAC) 등도 미래 산업으로 낙점하고 미래를 대비하고 있다. SK그룹은 세계 1위 HBM 제조사 SK하이닉스를 앞세워 미래를 열고 있다. 세계에서 최초로 HBM을 개발해 양산한 이 회사는 차세대 HBM인 HBM4도 양산 체제를 구축하고 엔비디아 납품을 대기하고 있다. SK의 AI 행보는 그룹을 넘어 국가 경쟁력 강화에도 기여하고 있다. 아마존과 함께 짓고 있는 ‘울산 AI 데이터센터’가 대표적이다. 글로벌 3위 완성차 제조사인 현대자동차그룹은 전기차와 도심항공교통(UAM) 로봇 등 미래 모빌리티 시대에 대비하기 위해 정의선 회장을 필두로 준비태세에 들어갔다. 현대차와 기아는 하이브리드카 전기차 주행거리연장형전기차(EREV) 등 내연기관에서 탈피한 신차를 내년부터 대거 내놓는다는 계획을 세웠다. 이와 함께 자동차 브랜드에 ‘프리미엄’과 ‘고성능’을 강화하며 글로벌 톱 완성차 회사로 자리매김하겠다는 전략이다. LG그룹은 AI와 바이오 클린테크 등 소위 ‘ABC’ 등을 성장산업으로 정하고 그룹 차원에서 2028년까지 50조원을 쏟아붓기로 했다. 이 중에서도 특히 AI에 올인하는 분위기다. 삼성·SK와 달리 반도체 제조사가 없는 LG는 최근 엑사원이란 하이브리드 AI 모델을 국내 최초로 개발해 공개했다. 주식시장, 제조업, 바이오, 가전제품 등에 엑사원을 적용해 그룹 전체적인 역량을 끌어올리겠다는 전략이다. 한화와 HD현대는 세계 1, 2위의 기술력을 자랑하는 조선사를 앞세워 나라를 구하는 중이다. 트럼프 대통령이 절실히 원하는 마스가(MASGA·미국 조선업을 다시 위대하게) 프로젝트에 나서며 새로운 시장 개척에 나선 것이다. 이를 필두로 전력기기(HD현대일렉트릭)와 방위산업, 우주(한화에어로스페이스) 등이 AI 시대의 수요 증가에 이미 대비를 마쳤다. 수소환원제철소로 전환하는 포스코는 주력 사업의 대전환기를 맞아 세계 석학들을 인천 송도로 불러들여 중심을 잡아줄 미래 전략을 모색하고 있다. 두산은 에너지와 산업기계 반도체소재 등을 미래 먹거리로 정하고 130년 역사에 변신 DNA를 심고 있다. AI가 촉발한 에너지 수요 폭증엔 LS와 효성 등이 사력을 다해 대비하고 있다. 이들 한국 기업이 고용량의 정밀한 전력기기 및 송·배전망의 글로벌 시장 장악에 나선 것이다. 롯데와 CJ, 신세계, 현대백화점, 농심, 오뚜기, 대상, 아모레 등은 방탄소년단(BTS), 오징어 게임, 케이팝 데몬 헌터스 등으로 이어지는 K문화를 세계 시장 확장의 기회로 삼고 도약을 마련하고 있다. 혁신의 주체는 기업이지만 정부도 손 놓고 있어선 안 된다는 지적 역시 끊임없이 나온다. 기업이 마음껏 도전하고 실패해도 다시 일어설 수 있는 ‘혁신의 장’을 마련해줘야 한다는 얘기다. 미래 기술을 우리 기업이 선점할 수 있도록 연구개발(R&D)을 지원하고 정책자금도 아끼지 말아야 한다. 그런데도 미래를 위한 과감한 결정에 형사처벌을 하는 배임죄나 주 52시간 강제화, 산업용 전기요금 인상, 원자력발전 퇴출, 중대재해처벌법 등 기업들의 미래 준비를 막는 규제도 여전히 산재해 있다. 61년 전 최빈국인 한국을 선진국 대열에 올려 놓은 건 기업가정신으로 무장한 도전의 역사였다는 사실을 다시 되새겨야 할 때다. 김재후 기자 hu@hankyung.com 2차 세계대전 이후 한국을 유일하게 선진국으로 올려 세운 동력은 기업이란 사실을 부정하는 사람은 없다. 반도체, 자동차, 가전, 조선, 석유화학, 철강, 식품, 화장품, 바이오 등 한국을 대표하는 기업이 잇따라 탄생했고, 그들이 구축한 생태계에서 일자리와 세금으로 이룬 결과다. 앞으로는 밝지 않다. 올 들어 한국을 둘러싼 글로벌 기업 환경이 수많은 변수와 도전에 직면해 있어서다. 도널드 트럼프 미국 대통령 취임 이후 미국의 관세 폭탄으로 시작된 글로벌 무역 퇴조와 주력 산업에서 중국 기업들의 추격 혹은 역전이 가시화하고 있다. 저출생으로 인구는 감소하는 와중에 미래 산업인 인공지능(AI), 로봇, 우주, 양자 등에서 미국, 중국 기업들은 한국 기업들을 따돌리고 저 멀리 뛰쳐나가고 있다. 한국 기업들은 뒤처지지 않기 위해 미래 준비에 전력을 다하고 있다. 그 선두에 AI를 앞세운 삼성과 SK가 있다. 지난 1일 방한한 샘 올트먼 오픈AI 최고경영자(CEO)는 이재용 삼성전자 회장, 최태원 SK그룹 회장에게 최대 100조원 규모의 고대역폭메모리(HBM) 수주를 약속했다. 오픈AI가 추진 중인 700조원 규모로 지어지는 AI데이터센터인 스타게이트 프로젝트에 두 회사의 HBM이 들어간다는 얘기다. HBM 외에도 삼성은 가전, TV, 반도체, 스마트폰 등 모든 제품에 AI를 접목하고 있다. 글로벌 시장을 장악한 제품에 AI를 더하겠다는 전략이다. 이와 함께 헬스케어와 로봇 냉난방공조(HVAC) 등도 미래 산업으로 낙점하고 미래를 대비하고 있다. SK그룹은 세계 1위 HBM 제조사 SK하이닉스를 앞세워 미래를 열고 있다. 세계에서 최초로 HBM을 개발해 양산한 이 회사는 차세대 HBM인 HBM4도 양산 체제를 구축하고 엔비디아 납품을 대기하고 있다. SK의 AI 행보는 그룹을 넘어 국가 경쟁력 강화에도 기여하고 있다. 아마존과 함께 짓고 있는 ‘울산 AI 데이터센터’가 대표적이다. 글로벌 3위 완성차 제조사인 현대자동차그룹은 전기차와 도심항공교통(UAM) 로봇 등 미래 모빌리티 시대에 대비하기 위해 정의선 회장을 필두로 준비태세에 들어갔다. 현대차와 기아는 하이브리드카 전기차 주행거리연장형전기차(EREV) 등 내연기관에서 탈피한 신차를 내년부터 대거 내놓는다는 계획을 세웠다. 이와 함께 자동차 브랜드에 ‘프리미엄’과 ‘고성능’을 강화하며 글로벌 톱 완성차 회사로 자리매김하겠다는 전략이다. LG그룹은 AI와 바이오 클린테크 등 소위 ‘ABC’ 등을 성장산업으로 정하고 그룹 차원에서 2028년까지 50조원을 쏟아붓기로 했다. 이 중에서도 특히 AI에 올인하는 분위기다. 삼성·SK와 달리 반도체 제조사가 없는 LG는 최근 엑사원이란 하이브리드 AI 모델을 국내 최초로 개발해 공개했다. 주식시장, 제조업, 바이오, 가전제품 등에 엑사원을 적용해 그룹 전체적인 역량을 끌어올리겠다는 전략이다. 한화와 HD현대는 세계 1, 2위의 기술력을 자랑하는 조선사를 앞세워 나라를 구하는 중이다. 트럼프 대통령이 절실히 원하는 마스가(MASGA·미국 조선업을 다시 위대하게) 프로젝트에 나서며 새로운 시장 개척에 나선 것이다. 이를 필두로 전력기기(HD현대일렉트릭)와 방위산업, 우주(한화에어로스페이스) 등이 AI 시대의 수요 증가에 이미 대비를 마쳤다. 수소환원제철소로 전환하는 포스코는 주력 사업의 대전환기를 맞아 세계 석학들을 인천 송도로 불러들여 중심을 잡아줄 미래 전략을 모색하고 있다. 두산은 에너지와 산업기계 반도체소재 등을 미래 먹거리로 정하고 130년 역사에 변신 DNA를 심고 있다. AI가 촉발한 에너지 수요 폭증엔 LS와 효성 등이 사력을 다해 대비하고 있다. 이들 한국 기업이 고용량의 정밀한 전력기기 및 송·배전망의 글로벌 시장 장악에 나선 것이다. 롯데와 CJ, 신세계, 현대백화점, 농심, 오뚜기, 대상, 아모레 등은 방탄소년단(BTS), 오징어 게임, 케이팝 데몬 헌터스 등으로 이어지는 K문화를 세계 시장 확장의 기회로 삼고 도약을 마련하고 있다. 혁신의 주체는 기업이지만 정부도 손 놓고 있어선 안 된다는 지적 역시 끊임없이 나온다. 기업이 마음껏 도전하고 실패해도 다시 일어설 수 있는 ‘혁신의 장’을 마련해줘야 한다는 얘기다. 미래 기술을 우리 기업이 선점할 수 있도록 연구개발(R&D)을 지원하고 정책자금도 아끼지 말아야 한다. 그런데도 미래를 위한 과감한 결정에 형사처벌을 하는 배임죄나 주 52시간 강제화, 산업용 전기요금 인상, 원자력발전 퇴출, 중대재해처벌법 등 기업들의 미래 준비를 막는 규제도 여전히 산재해 있다. 61년 전 최빈국인 한국을 선진국 대열에 올려 놓은 건 기업가정신으로 무장한 도전의 역사였다는 사실을 다시 되새겨야 할 때다. 김재후 기자 hu@hankyung.com ADVERTISEMENT ADVERTISEMENT",hankyung.com,https://www.hankyung.com/article/2025100990061,정상 (1차)
